{"schema":1,"id":"release-history.integrity","owner":"CHG-2026-0001","kind":"static","layer":"F0","depends_on":[],"reads":["release.history","product.package"],"writes":[],"effective_inputs":[".mir/releases/sources/published-source-locks.json",".mir/distributions.json","tools/mir/application/package/DistributionCustody.ps1","tests/release/Test-MIRPublishedSnapshotIntegrity.ps1"],"outputs":["result:release-history.integrity"],"resource_class":"disk-heavy","freshness":"content-eternal","side_effect":"temporary-files","retry":{"maximum_attempts":1,"retryable":false},"completion_proof":{"type":"structured-result","status":"passed"},"command":{"executable":"pwsh","arguments":["-File","tests/release/Test-MIRPublishedSnapshotIntegrity.ps1","-Index"]},"state":"planned"}
