{"schema":1,"id":"seal","owner":"CHG-2026-0001","kind":"transition","layer":"F4","activation":"release","depends_on":["protected.qualification"],"reads":["assurance.evidence","release.authority","product.package"],"writes":["release.authority"],"effective_inputs":["candidate-archive","result:protected.qualification","component-abi-set","tests/release/Test-MIRReleaseObligation.ps1"],"outputs":["result:seal","evidence:candidate-seal"],"resource_class":"gate","freshness":"always-fresh","side_effect":"evidence-write","retry":{"maximum_attempts":1,"retryable":false},"completion_proof":{"type":"seal","status":"passed"},"command":{"executable":"pwsh","arguments":["-File","tests/release/Test-MIRReleaseObligation.ps1","-Obligation","seal","-ContextPath","<context>"]},"state":"planned"}
